[
  {
    "slug": "chatgpt-vs-claude-vs-gemini-2026",
    "title": {
      "en": "ChatGPT vs Claude vs Gemini: The Ultimate 2026 Comparison",
      "zh": "ChatGPT vs Claude vs Gemini：2026 终极对比",
      "ja": "ChatGPT vs Claude vs Gemini：2026年 究極の比較",
      "es": "ChatGPT vs Claude vs Gemini: la comparación definitiva de 2026",
      "fr": "ChatGPT vs Claude vs Gemini : le comparatif ultime de 2026"
    },
    "excerpt": {
      "en": "We tested GPT-5, Claude 4.5, and Gemini 3.0 Pro across 10 real-world scenarios. Here's which AI model wins for coding, writing, analysis, and more.",
      "zh": "我们在 10 个真实场景中测试了 GPT-5、Claude 4.5 和 Gemini 3.0 Pro。以下是各模型在编程、写作、分析等方面的表现对比。",
      "ja": "GPT-5、Claude 4.5、Gemini 3.0 Pro を10の実際のシナリオでテストしました。コーディング、ライティング、分析などでどのAIモデルが勝つのかを紹介します。",
      "es": "Probamos GPT-5, Claude 4.5 y Gemini 3.0 Pro en 10 escenarios del mundo real. Descubre qué modelo de IA gana en programación, escritura, análisis y más.",
      "fr": "Nous avons testé GPT-5, Claude 4.5 et Gemini 3.0 Pro dans 10 scénarios réels. Voici quel modèle d'IA l'emporte pour le code, la rédaction, l'analyse et plus encore."
    },
    "content": {
      "en": "## Introduction\n\nThe AI landscape in 2026 is more competitive than ever. With GPT-5, Claude 4.5, and Gemini 3.0 Pro all vying for the top spot, choosing the right AI assistant can be overwhelming.\n\n## Testing Methodology\n\nWe evaluated each model across 10 categories:\n- Code generation and debugging\n- Creative writing\n- Data analysis\n- Mathematical reasoning\n- Multimodal understanding\n- Long context processing\n- Speed and responsiveness\n- API pricing\n- Ecosystem and integrations\n- Privacy and security\n\n## Results Summary\n\n### Best for Coding: Claude 4.5\nClaude 4.5's Computer Use 2.0 and 500K context window make it the undisputed champion for developers.\n\n### Best for Creative Writing: GPT-5\nGPT-5's enhanced reasoning produces more nuanced and creative outputs.\n\n### Best for Research: Gemini 3.0 Pro\nGoogle Search integration gives Gemini a unique advantage for real-time information.\n\n### Best Value: DeepSeek-V4\nWith API pricing at $0.14/million tokens, DeepSeek offers incredible value.",
      "zh": "## 引言\n\n2026 年的 AI 领域竞争空前激烈。GPT-5、Claude 4.5 和 Gemini 3.0 Pro 都在争夺榜首，选择合适的 AI 助手可能令人困惑。\n\n## 测试方法\n\n我们在 10 个类别中评估了每个模型：\n- 代码生成与调试\n- 创意写作\n- 数据分析\n- 数学推理\n- 多模态理解\n- 长上下文处理\n- 速度与响应\n- API 定价\n- 生态系统与集成\n- 隐私与安全\n\n## 结果总结\n\n### 编程最佳：Claude 4.5\nClaude 4.5 的 Computer Use 2.0 和 500K 上下文窗口使其成为开发者的无可争议的冠军。\n\n### 创意写作最佳：GPT-5\nGPT-5 增强的推理能力产生更细致和创造性的输出。\n\n### 研究最佳：Gemini 3.0 Pro\nGoogle 搜索集成为 Gemini 提供了实时信息的独特优势。\n\n### 性价比最佳：DeepSeek-V4\nAPI 定价仅为 $0.14/百万 tokens，DeepSeek 提供了令人难以置信的价值。",
      "ja": "## はじめに\n\n2026年のAI業界はかつてないほど競争が激化しています。GPT-5、Claude 4.5、Gemini 3.0 Pro が首位を争う中、適切なAIアシスタントを選ぶのは容易ではありません。\n\n## テスト方法\n\n各モデルを10のカテゴリーで評価しました：\n- コード生成とデバッグ\n- クリエイティブライティング\n- データ分析\n- 数学的推論\n- マルチモーダル理解\n- 長文コンテキスト処理\n- 速度と応答性\n- API料金\n- エコシステムと連携\n- プライバシーとセキュリティ\n\n## 結果まとめ\n\n### コーディング最優秀：Claude 4.5\nClaude 4.5 の Computer Use 2.0 と 500K コンテキストウィンドウにより、開発者にとって揺るぎない王者です。\n\n### クリエイティブライティング最優秀：GPT-5\nGPT-5 の強化された推論能力は、より繊細で創造的な出力を生み出します。\n\n### リサーチ最優秀：Gemini 3.0 Pro\nGoogle検索との統合により、Gemini はリアルタイム情報で独自の優位性を持ちます。\n\n### コストパフォーマンス最優秀：DeepSeek-V4\n100万トークンあたり$0.14というAPI料金で、DeepSeek は驚異的なコストパフォーマンスを提供します。",
      "es": "## Introducción\n\nEl panorama de la IA en 2026 es más competitivo que nunca. Con GPT-5, Claude 4.5 y Gemini 3.0 Pro compitiendo por el primer puesto, elegir el asistente de IA adecuado puede resultar abrumador.\n\n## Metodología de prueba\n\nEvaluamos cada modelo en 10 categorías:\n- Generación y depuración de código\n- Escritura creativa\n- Análisis de datos\n- Razonamiento matemático\n- Comprensión multimodal\n- Procesamiento de contexto largo\n- Velocidad y capacidad de respuesta\n- Precios de API\n- Ecosistema e integraciones\n- Privacidad y seguridad\n\n## Resumen de resultados\n\n### Mejor para programar: Claude 4.5\nEl Computer Use 2.0 de Claude 4.5 y su ventana de contexto de 500K lo convierten en el campeón indiscutible para desarrolladores.\n\n### Mejor para escritura creativa: GPT-5\nEl razonamiento mejorado de GPT-5 produce resultados más matizados y creativos.\n\n### Mejor para investigación: Gemini 3.0 Pro\nLa integración con Google Search le da a Gemini una ventaja única para la información en tiempo real.\n\n### Mejor relación calidad-precio: DeepSeek-V4\nCon un precio de API de $0,14 por millón de tokens, DeepSeek ofrece un valor increíble.",
      "fr": "## Introduction\n\nLe paysage de l'IA en 2026 est plus concurrentiel que jamais. Avec GPT-5, Claude 4.5 et Gemini 3.0 Pro qui se disputent la première place, choisir le bon assistant IA peut s'avérer complexe.\n\n## Méthodologie de test\n\nNous avons évalué chaque modèle sur 10 catégories :\n- Génération et débogage de code\n- Écriture créative\n- Analyse de données\n- Raisonnement mathématique\n- Compréhension multimodale\n- Traitement de contexte long\n- Vitesse et réactivité\n- Tarification de l'API\n- Écosystème et intégrations\n- Confidentialité et sécurité\n\n## Résumé des résultats\n\n### Meilleur pour le code : Claude 4.5\nLe Computer Use 2.0 de Claude 4.5 et sa fenêtre de contexte de 500K en font le champion incontesté pour les développeurs.\n\n### Meilleur pour l'écriture créative : GPT-5\nLe raisonnement amélioré de GPT-5 produit des résultats plus nuancés et créatifs.\n\n### Meilleur pour la recherche : Gemini 3.0 Pro\nL'intégration de Google Search donne à Gemini un avantage unique pour les informations en temps réel.\n\n### Meilleur rapport qualité-prix : DeepSeek-V4\nAvec une tarification API de 0,14 $ par million de tokens, DeepSeek offre une valeur incroyable."
    },
    "author": "CATAI Team",
    "publishedAt": "2026-07-15",
    "category": "comparison",
    "tags": ["ChatGPT", "Claude", "Gemini", "Comparison", "GPT-5", "Claude 4.5"],
    "coverImage": "https://images.unsplash.com/photo-1677442136019-21780ecad995?w=1200&h=630&fit=crop",
    "readTime": 8
  },
  {
    "slug": "best-free-ai-tools-2026",
    "title": {
      "en": "15 Best Free AI Tools You Should Use in 2026",
      "zh": "2026 年必用的 15 款免费 AI 工具",
      "ja": "2026年に使うべき無料AIツール ベスト15",
      "es": "Las 15 mejores herramientas de IA gratuitas que deberías usar en 2026",
      "fr": "Les 15 meilleurs outils d'IA gratuits à utiliser en 2026"
    },
    "excerpt": {
      "en": "Discover the top free AI tools that can boost your productivity without breaking the bank. From writing assistants to image generators, we've got you covered.",
      "zh": "发现可以提升你生产力的顶级免费 AI 工具，从写作助手到图像生成器，应有尽有。",
      "ja": "お財布を痛めずに生産性を高められる、最高の無料AIツールを紹介します。ライティングアシスタントから画像生成まで幅広くカバーします。",
      "es": "Descubre las mejores herramientas de IA gratuitas que pueden aumentar tu productividad sin gastar dinero. Desde asistentes de escritura hasta generadores de imágenes, lo tenemos todo.",
      "fr": "Découvrez les meilleurs outils d'IA gratuits pour booster votre productivité sans vous ruiner. Des assistants de rédaction aux générateurs d'images, nous avons tout prévu."
    },
    "content": {
      "en": "## Introduction\n\nYou don't need to spend a fortune to leverage the power of AI. Here are 15 exceptional free AI tools that deliver real value in 2026.\n\n## Writing & Content\n\n### 1. ChatGPT (Free Tier)\nStill the most versatile AI assistant. The free tier gives you access to GPT-4o mini for everyday tasks.\n\n### 2. Claude (Free Tier)\nExcellent for long-form writing and analysis with a generous free quota.\n\n### 3. Gemini (Free Tier)\nBest for research tasks thanks to Google Search integration.\n\n## Image Generation\n\n### 4. Stable Diffusion 4\nThe latest open-source image generation model. Run it locally for unlimited free generations.\n\n### 5. Microsoft Designer\nFree AI-powered design tool with DALL-E 3 integration.\n\n## Code & Development\n\n### 6. GitHub Copilot (Free for Students)\nAI pair programming that understands your entire codebase.\n\n### 7. Cursor (Free Tier)\nAI-first code editor with GPT-5 and Claude 4.5 support.\n\n### 8. DeepSeek Coder\nOpen-source coding model that rivals commercial alternatives.\n\n## Productivity\n\n### 9. Notion AI\nAI-powered workspace that helps you write, summarize, and organize.\n\n### 10. Otter.ai\nFree transcription service with AI-powered meeting summaries.\n\n## Learning & Research\n\n### 11. Perplexity AI\nAI-powered search engine that cites sources.\n\n### 12. Khanmigo\nKhan Academy's AI tutor, free for all students.\n\n## Audio & Video\n\n### 13. ElevenLabs (Free Tier)\nBest AI voice synthesis with generous free quota.\n\n### 14. Runway ML (Free Tier)\nAI video generation and editing tools.\n\n### 15. Suno AI\nCreate full songs with AI, free tier available.",
      "zh": "## 引言\n\n你不需要花大价钱就能利用 AI 的力量。以下是 2026 年 15 款真正有价值的免费 AI 工具。\n\n## 写作与内容\n\n### 1. ChatGPT（免费版）\n仍然是最多功能的 AI 助手。免费版提供 GPT-4o mini 用于日常任务。\n\n### 2. Claude（免费版）\n擅长长文写作和分析，免费额度慷慨。\n\n### 3. Gemini（免费版）\n得益于 Google 搜索集成，最适合研究任务。\n\n## 图像生成\n\n### 4. Stable Diffusion 4\n最新的开源图像生成模型。本地运行可无限免费生成。\n\n### 5. Microsoft Designer\n免费 AI 设计工具，集成 DALL-E 3。\n\n## 代码与开发\n\n### 6. GitHub Copilot（学生免费）\n理解你整个代码库的 AI 编程助手。\n\n### 7. Cursor（免费版）\n支持 GPT-5 和 Claude 4.5 的 AI 代码编辑器。\n\n### 8. DeepSeek Coder\n媲美商业替代方案的开源编程模型。\n\n## 生产力\n\n### 9. Notion AI\nAI 驱动的工作区，帮助你写作、总结和整理。\n\n### 10. Otter.ai\n免费转录服务，带 AI 会议摘要。\n\n## 学习与研究\n\n### 11. Perplexity AI\n引用来源的 AI 搜索引擎。\n\n### 12. Khanmigo\nKhan Academy 的 AI 导师，所有学生免费。\n\n## 音频与视频\n\n### 13. ElevenLabs（免费版）\n最佳 AI 语音合成，免费额度慷慨。\n\n### 14. Runway ML（免费版）\nAI 视频生成和编辑工具。\n\n### 15. Suno AI\n用 AI 创作完整歌曲，有免费版。",